"No.","Time","Source","Destination","Protocol","Length","Info"
"1","0.000000","192.168.29.45","192.168.29.1","TCP","66","51763  >  53 [SYN] Seq=0 Win=65535 Len=0 MSS=1460 WS=256 SACK_PERM"
"2","0.000685","192.168.29.45","192.168.29.1","TCP","66","51764  >  53 [SYN] Seq=0 Win=65535 Len=0 MSS=1460 WS=256 SACK_PERM"
"3","0.006419","192.168.29.1","192.168.29.45","TCP","66","53  >  51763 [SYN, ACK] Seq=0 Ack=1 Win=29200 Len=0 MSS=1460 SACK_PERM WS=64"
"4","0.006723","192.168.29.45","192.168.29.1","TCP","54","51763  >  53 [ACK] Seq=1 Ack=1 Win=65280 Len=0"
"5","0.006995","192.168.29.1","192.168.29.45","TCP","66","53  >  51764 [SYN, ACK] Seq=0 Ack=1 Win=29200 Len=0 MSS=1460 SACK_PERM WS=64"
"6","0.007226","192.168.29.45","192.168.29.1","TCP","56","51763  >  53 [PSH, ACK] Seq=1 Ack=1 Win=65280 Len=2 [TCP PDU reassembled in 8]"
"7","0.007282","192.168.29.45","192.168.29.1","TCP","54","51764  >  53 [ACK] Seq=1 Ack=1 Win=65280 Len=0"
"8","0.007720","192.168.29.45","192.168.29.1","DNS","104","Standard query 0x6154 A extension.femetrics.grammarly.io"
"9","0.008142","192.168.29.45","192.168.29.1","TCP","56","51764  >  53 [PSH, ACK] Seq=1 Ack=1 Win=65280 Len=2 [TCP PDU reassembled in 10]"
"10","0.008313","192.168.29.45","192.168.29.1","DNS","104","Standard query 0xc7e7 HTTPS extension.femetrics.grammarly.io"
"11","0.012622","192.168.29.1","192.168.29.45","TCP","54","53  >  51763 [ACK] Seq=1 Ack=3 Win=29248 Len=0"
"12","0.025304","192.168.29.1","192.168.29.45","TCP","54","53  >  51763 [ACK] Seq=1 Ack=53 Win=29248 Len=0"
"13","0.035348","192.168.29.1","192.168.29.45","TCP","54","53  >  51764 [ACK] Seq=1 Ack=53 Win=29248 Len=0"
"14","0.041666","192.168.29.1","192.168.29.45","TCP","55","53  >  51764 [PSH, ACK] Seq=1 Ack=53 Win=29248 Len=1 [TCP PDU reassembled in 17]"
"15","0.045312","192.168.29.1","192.168.29.45","TCP","54","[TCP Keep-Alive] 53  >  51764 [ACK] Seq=1 Ack=3 Win=29248 Len=0"
"16","0.045400","192.168.29.45","192.168.29.1","TCP","54","51764  >  53 [ACK] Seq=53 Ack=2 Win=65280 Len=0"
"17","0.047666","192.168.29.1","192.168.29.45","DNS","192","Standard query response 0xc7e7 HTTPS extension.femetrics.grammarly.io SOA ns-1688.awsdns-19.co.uk"
"18","0.047850","192.168.29.45","192.168.29.1","TCP","54","51764  >  53 [ACK] Seq=53 Ack=140 Win=65280 Len=0"
"19","0.048590","192.168.29.45","192.168.29.1","TCP","54","51764  >  53 [FIN, ACK] Seq=53 Ack=140 Win=65280 Len=0"
"20","0.052441","192.168.29.1","192.168.29.45","TCP","54","53  >  51764 [FIN, ACK] Seq=140 Ack=54 Win=29248 Len=0"
"21","0.052614","192.168.29.45","192.168.29.1","TCP","54","51764  >  53 [ACK] Seq=54 Ack=141 Win=65280 Len=0"
"22","0.056770","192.168.29.1","192.168.29.45","TCP","55","53  >  51763 [PSH, ACK] Seq=1 Ack=53 Win=29248 Len=1 [TCP PDU reassembled in 24]"
"23","0.110057","192.168.29.45","192.168.29.1","TCP","54","51763  >  53 [ACK] Seq=53 Ack=2 Win=65280 Len=0"
"24","0.111942","192.168.29.1","192.168.29.45","DNS","233","Standard query response 0x6154 A extension.femetrics.grammarly.io A 52.1.13.97 A 18.233.230.244 A 52.201.174.214 A 34.197.140.211 A 34.226.177.201 A 54.156.112.211 A 3.91.127.207 A 18.211.62.181"
"25","0.112740","192.168.29.45","192.168.29.1","TCP","54","51763  >  53 [FIN, ACK] Seq=53 Ack=181 Win=65280 Len=0"
"26","0.113786","192.168.29.45","52.1.13.97","TCP","66","51765  >  443 [SYN] Seq=0 Win=65535 Len=0 MSS=1460 WS=256 SACK_PERM"
"27","0.115899","192.168.29.1","192.168.29.45","TCP","54","53  >  51763 [FIN, ACK] Seq=181 Ack=54 Win=29248 Len=0"
"28","0.116059","192.168.29.45","192.168.29.1","TCP","54","51763  >  53 [ACK] Seq=54 Ack=182 Win=65280 Len=0"
"29","0.371167","52.1.13.97","192.168.29.45","TCP","66","443  >  51765 [SYN, ACK] Seq=0 Ack=1 Win=26883 Len=0 MSS=1460 SACK_PERM WS=256"
"30","0.371395","192.168.29.45","52.1.13.97","TCP","54","51765  >  443 [ACK] Seq=1 Ack=1 Win=65280 Len=0"
"31","0.373379","192.168.29.45","52.1.13.97","TLSv1.2","2030","Client Hello (SNI=extension.femetrics.grammarly.io)"
"32","0.678079","52.1.13.97","192.168.29.45","TLSv1.2","1514","Server Hello"
"33","0.678319","52.1.13.97","192.168.29.45","TCP","54","443  >  51765 [ACK] Seq=1 Ack=1461 Win=45056 Len=0"
"34","0.678363","192.168.29.45","52.1.13.97","TCP","54","51765  >  443 [ACK] Seq=1977 Ack=1461 Win=65280 Len=0"
"35","0.678574","52.1.13.97","192.168.29.45","TCP","54","443  >  51765 [ACK] Seq=1 Ack=1977 Win=47872 Len=0"
"36","0.678641","192.168.29.45","52.1.13.97","TCP","54","[TCP Dup ACK 34#1] 51765  >  443 [ACK] Seq=1977 Ack=1461 Win=65280 Len=0"
"37","0.678866","52.1.13.97","192.168.29.45","TCP","1514","443  >  51765 [ACK] Seq=1461 Ack=1977 Win=47872 Len=1460 [TCP PDU reassembled in 39]"
"38","0.679042","192.168.29.45","52.1.13.97","TCP","54","51765  >  443 [ACK] Seq=1977 Ack=2921 Win=65280 Len=0"
"39","0.679927","52.1.13.97","192.168.29.45","TLSv1.2","1431","Certificate, Server Key Exchange, Server Hello Done"
"40","0.682016","192.168.29.45","52.1.13.97","TLSv1.2","180","Client Key Exchange, Change Cipher Spec, Encrypted Handshake Message"
"41","0.682662","192.168.29.45","52.1.13.97","TLSv1.2","153","Application Data"
"42","0.683275","192.168.29.45","52.1.13.97","TLSv1.2","416","Application Data"
"43","0.683551","192.168.29.45","52.1.13.97","TLSv1.2","8785","Application Data"
"44","0.985947","52.1.13.97","192.168.29.45","TCP","54","443  >  51765 [ACK] Seq=4298 Ack=2103 Win=47872 Len=0"
"45","0.986478","52.1.13.97","192.168.29.45","TLSv1.2","258","New Session Ticket, Change Cipher Spec, Encrypted Handshake Message"
"46","0.986478","52.1.13.97","192.168.29.45","TLSv1.2","123","Application Data"
"47","0.986683","192.168.29.45","52.1.13.97","TCP","54","51765  >  443 [ACK] Seq=11295 Ack=4571 Win=65280 Len=0"
"48","0.986971","52.1.13.97","192.168.29.45","TLSv1.2","92","Application Data"
"49","0.986971","52.1.13.97","192.168.29.45","TCP","54","443  >  51765 [ACK] Seq=4609 Ack=9864 Win=68608 Len=0"
"50","0.987180","52.1.13.97","192.168.29.45","TCP","54","443  >  51765 [ACK] Seq=4609 Ack=11295 Win=86528 Len=0"
"51","0.987630","192.168.29.45","52.1.13.97","TLSv1.2","92","Application Data"
"52","1.009039","52.1.13.97","192.168.29.45","TLSv1.2","426","Application Data"
"53","1.060897","192.168.29.45","52.1.13.97","TCP","54","51765  >  443 [ACK] Seq=11333 Ack=4981 Win=65024 Len=0"
"54","1.292362","52.1.13.97","192.168.29.45","TCP","54","443  >  51765 [ACK] Seq=4981 Ack=11333 Win=86528 Len=0"
"55","1.863964","192.168.29.45","142.250.194.68","QUIC","1292","Initial, DCID=37b045fdc3494b66, PKN: 1, CRYPTO, PING, CRYPTO, CRYPTO, PING, PADDING, PING, CRYPTO, PADDING, CRYPTO, PADDING, PING"
"56","1.864245","192.168.29.45","142.250.194.68","QUIC","1292","Initial, DCID=37b045fdc3494b66, PKN: 2, CRYPTO"
"57","1.864422","192.168.29.45","142.250.194.68","QUIC","1292","Initial, DCID=37b045fdc3494b66, PKN: 3, PING, CRYPTO, PING, PING, PING, PADDING, PING, CRYPTO, PADDING, CRYPTO, CRYPTO, PING, CRYPTO, PING, CRYPTO, PADDING"
"58","1.865300","192.168.29.45","142.250.194.68","QUIC","120","0-RTT, DCID=37b045fdc3494b66"
"59","1.917402","142.250.194.68","192.168.29.45","QUIC","82","Initial, SCID=f7b045fdc3494b66, PKN: 1, ACK"
"60","1.922994","142.250.194.68","192.168.29.45","QUIC","82","Initial, SCID=f7b045fdc3494b66, PKN: 2, ACK"
"61","1.930909","142.250.194.68","192.168.29.45","QUIC","1292","Initial, SCID=f7b045fdc3494b66, PKN: 3, ACK, PADDING"
"62","1.931255","142.250.194.68","192.168.29.45","QUIC","1292","Initial, SCID=f7b045fdc3494b66, PKN: 4, ACK, PADDING"
"63","1.965881","192.168.29.45","142.250.194.68","QUIC","1292","Initial, DCID=f7b045fdc3494b66, PKN: 6, PADDING, PING, PADDING"
"64","1.994105","142.250.194.68","192.168.29.45","QUIC","1292","Initial, SCID=f7b045fdc3494b66, PKN: 5, CRYPTO, PADDING"
"65","1.995266","142.250.194.68","192.168.29.45","QUIC","343","Protected Payload (KP0)"
"66","1.995418","142.250.194.68","192.168.29.45","QUIC","991","Protected Payload (KP0)"
"67","1.995580","142.250.194.68","192.168.29.45","QUIC","116","Protected Payload (KP0)"
"68","1.995930","142.250.194.68","192.168.29.45","QUIC","66","Protected Payload (KP0)"
"69","1.996251","192.168.29.45","142.250.194.68","QUIC","1292","Initial, DCID=f7b045fdc3494b66, PKN: 7, ACK, PADDING"
"70","1.997601","192.168.29.45","142.250.194.68","QUIC","121","Handshake, DCID=f7b045fdc3494b66"
"71","1.998296","192.168.29.45","142.250.194.68","QUIC","73","Protected Payload (KP0), DCID=f7b045fdc3494b66"
"72","2.008096","142.250.194.68","192.168.29.45","QUIC","1292","Initial, SCID=f7b045fdc3494b66, PKN: 11, ACK, CRYPTO, PADDING"
"73","2.027952","192.168.29.45","142.250.194.68","QUIC","74","Protected Payload (KP0), DCID=f7b045fdc3494b66"
"74","2.038198","142.250.194.68","192.168.29.45","QUIC","162","Protected Payload (KP0)"
"75","2.038940","192.168.29.45","142.250.194.68","QUIC","75","Protected Payload (KP0), DCID=f7b045fdc3494b66"
"76","3.911545","192.168.29.45","13.67.9.5","TLSv1.2","888","Application Data"
"77","3.980098","13.67.9.5","192.168.29.45","TLSv1.2","432","Application Data"
"78","4.024828","192.168.29.45","13.67.9.5","TCP","54","51691  >  443 [ACK] Seq=835 Ack=379 Win=255 Len=0"
"79","4.194545","192.168.29.45","239.255.255.250","SSDP","484","NOTIFY * HTTP/1.1 "
"80","4.216231","192.168.29.45","239.255.255.250","SSDP","493","NOTIFY * HTTP/1.1 "
"81","4.260990","192.168.29.45","192.168.29.1","TCP","66","51767  >  53 [SYN] Seq=0 Win=65535 Len=0 MSS=1460 WS=256 SACK_PERM"
"82","4.261357","192.168.29.45","192.168.29.1","TCP","66","51768  >  53 [SYN] Seq=0 Win=65535 Len=0 MSS=1460 WS=256 SACK_PERM"
"83","4.267576","192.168.29.1","192.168.29.45","TCP","66","53  >  51767 [SYN, ACK] Seq=0 Ack=1 Win=29200 Len=0 MSS=1460 SACK_PERM WS=64"
"84","4.267712","192.168.29.45","192.168.29.1","TCP","54","51767  >  53 [ACK] Seq=1 Ack=1 Win=65280 Len=0"
"85","4.268060","192.168.29.45","192.168.29.1","TCP","56","51767  >  53 [PSH, ACK] Seq=1 Ack=1 Win=65280 Len=2 [TCP PDU reassembled in 86]"
"86","4.268143","192.168.29.45","192.168.29.1","DNS","86","Standard query 0x3c1e A www.reddit.com"
"87","4.269241","192.168.29.1","192.168.29.45","TCP","66","53  >  51768 [SYN, ACK] Seq=0 Ack=1 Win=29200 Len=0 MSS=1460 SACK_PERM WS=64"
"88","4.269395","192.168.29.45","192.168.29.1","TCP","54","51768  >  53 [ACK] Seq=1 Ack=1 Win=65280 Len=0"
"89","4.269547","192.168.29.45","192.168.29.1","TCP","56","51768  >  53 [PSH, ACK] Seq=1 Ack=1 Win=65280 Len=2 [TCP PDU reassembled in 90]"
"90","4.269630","192.168.29.45","192.168.29.1","DNS","86","Standard query 0x2901 HTTPS www.reddit.com"
"91","4.280187","192.168.29.1","192.168.29.45","TCP","54","53  >  51767 [ACK] Seq=1 Ack=35 Win=29248 Len=0"
"92","4.291403","192.168.29.1","192.168.29.45","TCP","54","53  >  51768 [ACK] Seq=1 Ack=35 Win=29248 Len=0"
"93","4.298502","192.168.29.1","192.168.29.45","TCP","54","53  >  51767 [ACK] Seq=1 Ack=3 Win=29248 Len=0"
"94","4.309013","192.168.29.1","192.168.29.45","TCP","54","53  >  51768 [ACK] Seq=1 Ack=3 Win=29248 Len=0"
"95","4.312030","192.168.29.1","192.168.29.45","TCP","55","53  >  51767 [PSH, ACK] Seq=1 Ack=35 Win=29248 Len=1 [TCP PDU reassembled in 99]"
"96","4.326865","192.168.29.1","192.168.29.45","TCP","55","53  >  51768 [PSH, ACK] Seq=1 Ack=35 Win=29248 Len=1 [TCP PDU reassembled in 104]"
"97","4.352255","192.168.29.45","239.255.255.250","SSDP","540","NOTIFY * HTTP/1.1 "
"98","4.353054","192.168.29.45","192.168.29.1","TCP","54","51767  >  53 [ACK] Seq=35 Ack=2 Win=65280 Len=0"
"99","4.363039","192.168.29.1","192.168.29.45","DNS","138","Standard query response 0x3c1e A www.reddit.com CNAME reddit.map.fastly.net A 199.232.105.140"
"100","4.363371","192.168.29.45","192.168.29.1","TCP","54","51767  >  53 [FIN, ACK] Seq=35 Ack=86 Win=65280 Len=0"
"101","4.365669","192.168.29.1","192.168.29.45","TCP","54","53  >  51767 [FIN, ACK] Seq=86 Ack=36 Win=29248 Len=0"
"102","4.365752","192.168.29.45","192.168.29.1","TCP","54","51767  >  53 [ACK] Seq=36 Ack=87 Win=65280 Len=0"
"103","4.368253","192.168.29.45","192.168.29.1","TCP","54","51768  >  53 [ACK] Seq=35 Ack=2 Win=65280 Len=0"
"104","4.370628","192.168.29.1","192.168.29.45","DNS","180","Standard query response 0x2901 HTTPS www.reddit.com CNAME reddit.map.fastly.net SOA ns1.fastly.net"
"105","4.371027","192.168.29.45","192.168.29.1","TCP","54","51768  >  53 [FIN, ACK] Seq=35 Ack=128 Win=65280 Len=0"
"106","4.371602","192.168.29.45","199.232.105.140","TCP","66","51769  >  443 [SYN] Seq=0 Win=65535 Len=0 MSS=1460 WS=256 SACK_PERM"
"107","4.371768","192.168.29.45","239.255.255.250","SSDP","548","NOTIFY * HTTP/1.1 "
"108","4.378169","192.168.29.1","192.168.29.45","TCP","54","53  >  51768 [FIN, ACK] Seq=128 Ack=36 Win=29248 Len=0"
"109","4.378260","192.168.29.45","192.168.29.1","TCP","54","51768  >  53 [ACK] Seq=36 Ack=129 Win=65280 Len=0"
"110","4.380795","199.232.105.140","192.168.29.45","TCP","66","443  >  51769 [SYN, ACK] Seq=0 Ack=1 Win=65535 Len=0 MSS=1460 SACK_PERM WS=512"
"111","4.380980","192.168.29.45","199.232.105.140","TCP","54","51769  >  443 [ACK] Seq=1 Ack=1 Win=65280 Len=0"
"112","4.383251","192.168.29.45","199.232.105.140","TLSv1.3","2097","Client Hello (SNI=www.reddit.com)"
"113","4.390571","199.232.105.140","192.168.29.45","TCP","54","443  >  51769 [ACK] Seq=1 Ack=1461 Win=148992 Len=0"
"114","4.392496","199.232.105.140","192.168.29.45","TCP","54","443  >  51769 [ACK] Seq=1 Ack=2044 Win=152064 Len=0"
"115","4.400410","192.168.29.45","239.255.255.250","SSDP","538","NOTIFY * HTTP/1.1 "
"116","4.407345","199.232.105.140","192.168.29.45","TLSv1.3","1510","Server Hello, Change Cipher Spec, Application Data, Application Data"
"117","4.411305","199.232.105.140","192.168.29.45","TLSv1.3","139","Application Data"
"118","4.411399","192.168.29.45","199.232.105.140","TCP","54","51769  >  443 [ACK] Seq=2044 Ack=1542 Win=65280 Len=0"
"119","4.413369","192.168.29.45","199.232.105.140","TLSv1.3","118","Change Cipher Spec, Application Data"
"120","4.413912","192.168.29.45","199.232.105.140","TLSv1.3","146","Application Data"
"121","4.414742","192.168.29.45","199.232.105.140","TLSv1.3","3100","Application Data"
"122","4.415043","192.168.29.45","199.232.105.140","TLSv1.3","3081","Application Data"
"123","4.415155","192.168.29.45","199.232.105.140","TLSv1.3","928","Application Data"
"124","4.420639","199.232.105.140","192.168.29.45","TCP","139","[TCP Spurious Retransmission] 443  >  51769 [PSH, ACK] Seq=1457 Ack=2044 Win=152064 Len=85 [TCP PDU reassembled in 117]"
"125","4.420689","192.168.29.45","199.232.105.140","TCP","66","[TCP Dup ACK 118#1] 51769  >  443 [ACK] Seq=9147 Ack=1542 Win=65280 Len=0 SLE=1457 SRE=1542"
"126","4.423276","199.232.105.140","192.168.29.45","TCP","66","[TCP Dup ACK 114#1] 443  >  51769 [ACK] Seq=1542 Ack=2044 Win=155136 Len=0 SLE=5246 SRE=6706"
"127","4.423732","199.232.105.140","192.168.29.45","TCP","66","443  >  51769 [ACK] Seq=1542 Ack=2108 Win=155136 Len=0 SLE=5246 SRE=6706"
"128","4.423814","199.232.105.140","192.168.29.45","TCP","66","[TCP Dup ACK 127#1] 443  >  51769 [ACK] Seq=1542 Ack=2108 Win=157696 Len=0 SLE=5246 SRE=8166"
"129","4.423962","199.232.105.140","192.168.29.45","TCP","66","443  >  51769 [ACK] Seq=1542 Ack=2200 Win=157696 Len=0 SLE=5246 SRE=8166"
"130","4.425666","199.232.105.140","192.168.29.45","TCP","66","[TCP Dup ACK 129#1] 443  >  51769 [ACK] Seq=1542 Ack=2200 Win=157696 Len=0 SLE=5246 SRE=8273"
"131","4.425666","199.232.105.140","192.168.29.45","TCP","66","443  >  51769 [ACK] Seq=1542 Ack=3660 Win=160768 Len=0 SLE=5246 SRE=8273"
"132","4.425666","199.232.105.140","192.168.29.45","TCP","66","[TCP Dup ACK 131#1] 443  >  51769 [ACK] Seq=1542 Ack=3660 Win=163840 Len=0 SLE=5246 SRE=9147"
"133","4.425812","199.232.105.140","192.168.29.45","TLSv1.3","131","Application Data"
"134","4.426199","199.232.105.140","192.168.29.45","TCP","66","443  >  51769 [ACK] Seq=1607 Ack=5120 Win=166912 Len=0 SLE=5246 SRE=9147"
"135","4.426289","199.232.105.140","192.168.29.45","TCP","54","443  >  51769 [ACK] Seq=1607 Ack=9147 Win=166912 Len=0"
"136","4.426494","192.168.29.45","199.232.105.140","TLSv1.3","85","Application Data"
"137","4.431594","199.232.105.140","192.168.29.45","TCP","54","443  >  51769 [ACK] Seq=1607 Ack=9178 Win=166912 Len=0"
"138","4.499045","192.168.29.45","239.255.255.250","SSDP","550","NOTIFY * HTTP/1.1 "
"139","4.773692","199.232.105.140","192.168.29.45","TLSv1.3","1510","Application Data"
"140","4.775228","199.232.105.140","192.168.29.45","TLSv1.3","959","Application Data"
"141","4.775318","192.168.29.45","199.232.105.140","TCP","54","51769  >  443 [ACK] Seq=9178 Ack=3968 Win=65280 Len=0"
"142","4.775611","199.232.105.140","192.168.29.45","TLSv1.3","1510","Application Data"
"143","4.775704","199.232.105.140","192.168.29.45","TLSv1.3","224","Application Data"
"144","4.775757","192.168.29.45","199.232.105.140","TCP","54","51769  >  443 [ACK] Seq=9178 Ack=5594 Win=65280 Len=0"
"145","4.775862","199.232.105.140","192.168.29.45","TCP","224","[TCP Spurious Retransmission] 443  >  51769 [PSH, ACK] Seq=5424 Ack=9178 Win=166912 Len=170 [TCP PDU reassembled in 143]"
"146","4.775901","192.168.29.45","199.232.105.140","TCP","66","[TCP Dup ACK 144#1] 51769  >  443 [ACK] Seq=9178 Ack=5594 Win=65280 Len=0 SLE=5424 SRE=5594"
"147","4.949197","192.168.29.45","192.168.29.1","TCP","66","51770  >  53 [SYN] Seq=0 Win=65535 Len=0 MSS=1460 WS=256 SACK_PERM"
"148","4.949562","192.168.29.45","192.168.29.1","TCP","66","51771  >  53 [SYN] Seq=0 Win=65535 Len=0 MSS=1460 WS=256 SACK_PERM"
"149","4.956595","192.168.29.1","192.168.29.45","TCP","66","53  >  51770 [SYN, ACK] Seq=0 Ack=1 Win=29200 Len=0 MSS=1460 SACK_PERM WS=64"
"150","4.956745","192.168.29.45","192.168.29.1","TCP","54","51770  >  53 [ACK] Seq=1 Ack=1 Win=65280 Len=0"
"151","4.956921","192.168.29.45","192.168.29.1","TCP","56","51770  >  53 [PSH, ACK] Seq=1 Ack=1 Win=65280 Len=2 [TCP PDU reassembled in 152]"
"152","4.957015","192.168.29.45","192.168.29.1","DNS","94","Standard query 0x27a5 A matrix.redditspace.com"
"153","4.957627","192.168.29.1","192.168.29.45","TCP","66","53  >  51771 [SYN, ACK] Seq=0 Ack=1 Win=29200 Len=0 MSS=1460 SACK_PERM WS=64"
"154","4.957752","192.168.29.45","192.168.29.1","TCP","54","51771  >  53 [ACK] Seq=1 Ack=1 Win=65280 Len=0"
"155","4.958146","192.168.29.45","192.168.29.1","TCP","56","51771  >  53 [PSH, ACK] Seq=1 Ack=1 Win=65280 Len=2 [TCP PDU reassembled in 156]"
"156","4.958229","192.168.29.45","192.168.29.1","DNS","94","Standard query 0x30fd HTTPS matrix.redditspace.com"
"157","4.971017","192.168.29.1","192.168.29.45","TCP","54","53  >  51770 [ACK] Seq=1 Ack=43 Win=29248 Len=0"
"158","4.982789","192.168.29.1","192.168.29.45","TCP","54","53  >  51771 [ACK] Seq=1 Ack=43 Win=29248 Len=0"
"159","4.991444","192.168.29.1","192.168.29.45","TCP","54","53  >  51770 [ACK] Seq=1 Ack=3 Win=29248 Len=0"
"160","5.000016","192.168.29.1","192.168.29.45","TCP","54","53  >  51771 [ACK] Seq=1 Ack=3 Win=29248 Len=0"
"161","5.000739","192.168.29.1","192.168.29.45","TCP","55","53  >  51770 [PSH, ACK] Seq=1 Ack=43 Win=29248 Len=1 [TCP PDU reassembled in 165]"
"162","5.011416","192.168.29.1","192.168.29.45","TCP","55","53  >  51771 [PSH, ACK] Seq=1 Ack=43 Win=29248 Len=1 [TCP PDU reassembled in 166]"
"163","5.051433","192.168.29.45","192.168.29.1","TCP","54","51770  >  53 [ACK] Seq=43 Ack=2 Win=65280 Len=0"
"164","5.051522","192.168.29.45","192.168.29.1","TCP","54","51771  >  53 [ACK] Seq=43 Ack=2 Win=65280 Len=0"
"165","5.055719","192.168.29.1","192.168.29.45","DNS","156","Standard query response 0x27a5 A matrix.redditspace.com CNAME dualstack.reddit.map.fastly.net A 199.232.105.140"
"166","5.056138","192.168.29.1","192.168.29.45","DNS","198","Standard query response 0x30fd HTTPS matrix.redditspace.com CNAME dualstack.reddit.map.fastly.net SOA ns1.fastly.net"
"167","5.056706","192.168.29.45","192.168.29.1","TCP","54","51770  >  53 [FIN, ACK] Seq=43 Ack=104 Win=65280 Len=0"
"168","5.058482","192.168.29.1","192.168.29.45","TCP","54","53  >  51770 [FIN, ACK] Seq=104 Ack=44 Win=29248 Len=0"
"169","5.058572","192.168.29.45","192.168.29.1","TCP","54","51770  >  53 [ACK] Seq=44 Ack=105 Win=65280 Len=0"
"170","5.060984","192.168.29.45","192.168.29.1","TCP","54","51771  >  53 [FIN, ACK] Seq=43 Ack=146 Win=65280 Len=0"
"171","5.062415","192.168.29.1","192.168.29.45","TCP","54","53  >  51771 [FIN, ACK] Seq=146 Ack=44 Win=29248 Len=0"
"172","5.062528","192.168.29.45","192.168.29.1","TCP","54","51771  >  53 [ACK] Seq=44 Ack=147 Win=65280 Len=0"
"173","5.071390","192.168.29.45","199.232.105.140","QUIC","1292","Initial, DCID=9dd23afe3149c7b4, PKN: 1, PADDING, CRYPTO, CRYPTO, CRYPTO, PADDING, CRYPTO, PING, PADDING, PING, CRYPTO, CRYPTO, CRYPTO, PING"
"174","5.071606","192.168.29.45","199.232.105.140","QUIC","1292","Initial, DCID=9dd23afe3149c7b4, PKN: 2, CRYPTO, PADDING, PING, PADDING, CRYPTO, PING, CRYPTO, PING, PADDING, CRYPTO, PING, CRYPTO, PING, CRYPTO, PING, PING, CRYPTO"
"175","5.088418","199.232.105.140","192.168.29.45","QUIC","1322","Initial, SCID=d0fefe10e86abeca293b214000c1595fe1, PKN: 0, ACK, PADDING"
"176","5.096349","199.232.105.140","192.168.29.45","QUIC","1322","Initial, SCID=d0fefe10e86abeca293b214000c1595fe1, PKN: 1, ACK, CRYPTO, PADDING"
"177","5.096907","199.232.105.140","192.168.29.45","QUIC","620","Protected Payload (KP0)"
"178","5.098071","192.168.29.45","199.232.105.140","QUIC","1292","Initial, DCID=d0fefe10e86abeca293b214000c1595fe1, PKN: 3, ACK, PADDING"
"179","5.103216","192.168.29.45","199.232.105.140","QUIC","91","Handshake, DCID=d0fefe10e86abeca293b214000c1595fe1"
"180","5.103798","192.168.29.45","199.232.105.140","QUIC","140","Handshake, DCID=d0fefe10e86abeca293b214000c1595fe1"
"181","5.105408","192.168.29.45","199.232.105.140","QUIC","123","Protected Payload (KP0), DCID=d0fefe10e86abeca293b214000c1595fe1"
"182","5.107440","192.168.29.45","199.232.105.140","QUIC","1292","Protected Payload (KP0), DCID=d0fefe10e86abeca293b214000c1595fe1"
"183","5.107621","192.168.29.45","199.232.105.140","QUIC","937","Protected Payload (KP0), DCID=d0fefe10e86abeca293b214000c1595fe1"
"184","5.110431","199.232.105.140","192.168.29.45","QUIC","63","Protected Payload (KP0)"
"185","5.116494","199.232.105.140","192.168.29.45","QUIC","66","Protected Payload (KP0)"
"186","5.148940","192.168.29.45","199.232.105.140","QUIC","84","Protected Payload (KP0), DCID=d0fefe10e86abeca293b214000c1595fe1"
"187","5.358808","192.168.29.45","199.232.105.140","QUIC","80","Protected Payload (KP0), DCID=d0fefe10e86abeca293b214000c1595fe1"
"188","5.391153","199.232.105.140","192.168.29.45","QUIC","66","Protected Payload (KP0)"
"189","5.598502","192.168.29.45","199.232.105.140","QUIC","80","Protected Payload (KP0), DCID=d0fefe10e86abeca293b214000c1595fe1"
"190","5.631630","199.232.105.140","192.168.29.45","QUIC","66","Protected Payload (KP0)"
"191","5.797393","44.219.151.147","192.168.29.45","TLSv1.2","94","Application Data"
"192","5.798264","192.168.29.45","44.219.151.147","TLSv1.2","97","Application Data"
"193","5.847447","192.168.29.45","199.232.105.140","QUIC","80","Protected Payload (KP0), DCID=d0fefe10e86abeca293b214000c1595fe1"
"194","5.885140","199.232.105.140","192.168.29.45","QUIC","66","Protected Payload (KP0)"
"195","6.096268","192.168.29.45","199.232.105.140","QUIC","80","Protected Payload (KP0), DCID=d0fefe10e86abeca293b214000c1595fe1"
"196","6.103632","44.219.151.147","192.168.29.45","TCP","54","443  >  48420 [ACK] Seq=41 Ack=44 Win=361 Len=0"
"197","6.130194","199.232.105.140","192.168.29.45","QUIC","66","Protected Payload (KP0)"
"198","6.146314","192.168.29.45","192.168.29.1","TCP","66","51773  >  53 [SYN] Seq=0 Win=65535 Len=0 MSS=1460 WS=256 SACK_PERM"
"199","6.146657","192.168.29.45","192.168.29.1","TCP","66","51774  >  53 [SYN] Seq=0 Win=65535 Len=0 MSS=1460 WS=256 SACK_PERM"
"200","6.150112","192.168.29.1","192.168.29.45","TCP","66","53  >  51773 [SYN, ACK] Seq=0 Ack=1 Win=29200 Len=0 MSS=1460 SACK_PERM WS=64"
"201","6.150249","192.168.29.45","192.168.29.1","TCP","54","51773  >  53 [ACK] Seq=1 Ack=1 Win=65280 Len=0"
"202","6.150546","192.168.29.1","192.168.29.45","TCP","66","53  >  51774 [SYN, ACK] Seq=0 Ack=1 Win=29200 Len=0 MSS=1460 SACK_PERM WS=64"
"203","6.150644","192.168.29.45","192.168.29.1","TCP","54","51774  >  53 [ACK] Seq=1 Ack=1 Win=65280 Len=0"
"204","6.150876","192.168.29.45","192.168.29.1","TCP","56","51773  >  53 [PSH, ACK] Seq=1 Ack=1 Win=65280 Len=2 [TCP PDU reassembled in 205]"
"205","6.151023","192.168.29.45","192.168.29.1","DNS","107","Standard query 0x2aa6 A optimizationguide-pa.googleapis.com"
"206","6.151188","192.168.29.45","192.168.29.1","TCP","56","51774  >  53 [PSH, ACK] Seq=1 Ack=1 Win=65280 Len=2 [TCP PDU reassembled in 207]"
"207","6.151255","192.168.29.45","192.168.29.1","DNS","107","Standard query 0x58c3 HTTPS optimizationguide-pa.googleapis.com"
"208","6.163029","192.168.29.1","192.168.29.45","TCP","54","53  >  51773 [ACK] Seq=1 Ack=56 Win=29248 Len=0"
"209","6.170457","199.232.105.140","192.168.29.45","QUIC","833","Protected Payload (KP0)"
"210","6.171438","199.232.105.140","192.168.29.45","QUIC","355","Protected Payload (KP0)"
"211","6.174784","192.168.29.45","199.232.105.140","QUIC","82","Protected Payload (KP0), DCID=d0fefe10e86abeca293b214000c1595fe1"
"212","6.177603","192.168.29.1","192.168.29.45","TCP","54","53  >  51774 [ACK] Seq=1 Ack=56 Win=29248 Len=0"
"213","6.183763","192.168.29.45","199.232.105.140","TLSv1.3","3073","Application Data"
"214","6.184146","192.168.29.45","199.232.105.140","TLSv1.3","2633","Application Data"
"215","6.185508","192.168.29.1","192.168.29.45","TCP","54","53  >  51773 [ACK] Seq=1 Ack=3 Win=29248 Len=0"
"216","6.187732","192.168.29.1","192.168.29.45","TCP","55","53  >  51774 [PSH, ACK] Seq=1 Ack=56 Win=29248 Len=1 [TCP PDU reassembled in 225]"
"217","6.189366","192.168.29.45","199.232.105.140","TLSv1.3","2915","Application Data"
"218","6.191427","199.232.105.140","192.168.29.45","TCP","54","443  >  51769 [ACK] Seq=5594 Ack=12098 Win=172544 Len=0"
"219","6.192368","199.232.105.140","192.168.29.45","TCP","54","443  >  51769 [ACK] Seq=5594 Ack=12197 Win=172544 Len=0"
"220","6.192489","199.232.105.140","192.168.29.45","TCP","54","443  >  51769 [ACK] Seq=5594 Ack=14776 Win=178176 Len=0"
"221","6.193870","192.168.29.1","192.168.29.45","TCP","55","53  >  51773 [PSH, ACK] Seq=1 Ack=56 Win=29248 Len=1 [TCP PDU reassembled in 231]"
"222","6.195042","192.168.29.1","192.168.29.45","TCP","54","[TCP Keep-Alive] 53  >  51774 [ACK] Seq=1 Ack=3 Win=29248 Len=0"
"223","6.195088","192.168.29.45","192.168.29.1","TCP","54","51774  >  53 [ACK] Seq=56 Ack=2 Win=65280 Len=0"
"224","6.195956","199.232.105.140","192.168.29.45","TCP","56","443  >  51769 [ACK] Seq=5594 Ack=17637 Win=184320 Len=0"
"225","6.196881","192.168.29.1","192.168.29.45","DNS","165","Standard query response 0x58c3 HTTPS optimizationguide-pa.googleapis.com SOA ns1.google.com"
"226","6.196966","192.168.29.45","192.168.29.1","TCP","54","51774  >  53 [ACK] Seq=56 Ack=113 Win=65280 Len=0"
"227","6.197264","192.168.29.45","192.168.29.1","TCP","54","51774  >  53 [FIN, ACK] Seq=56 Ack=113 Win=65280 Len=0"
"228","6.198640","192.168.29.1","192.168.29.45","TCP","54","53  >  51774 [FIN, ACK] Seq=113 Ack=57 Win=29248 Len=0"
"229","6.198734","192.168.29.45","192.168.29.1","TCP","54","51774  >  53 [ACK] Seq=57 Ack=114 Win=65280 Len=0"
"230","6.237469","192.168.29.45","192.168.29.1","TCP","54","51773  >  53 [ACK] Seq=56 Ack=2 Win=65280 Len=0"
"231","6.239125","192.168.29.1","192.168.29.45","DNS","364","Standard query response 0x2aa6 A optimizationguide-pa.googleapis.com A 142.250.195.10 A 142.250.207.202 A 142.250.207.234 A 172.217.166.10 A 172.217.27.170 A 172.217.167.234 A 216.58.196.106 A 142.251.223.106 A 142.251.43.170 A 142.251.43.106 A 142.250.77.234 A 142.250.182.170 A 142.250.192.170 A 142.250.192.202 A 142.250.193.74 A 142.250.77.202"
"232","6.241502","192.168.29.45","192.168.29.1","TCP","54","51773  >  53 [FIN, ACK] Seq=56 Ack=312 Win=65024 Len=0"
"233","6.242879","192.168.29.1","192.168.29.45","TCP","54","53  >  51773 [FIN, ACK] Seq=312 Ack=57 Win=29248 Len=0"
"234","6.242971","192.168.29.45","192.168.29.1","TCP","54","51773  >  53 [ACK] Seq=57 Ack=313 Win=65024 Len=0"
"235","6.255345","192.168.29.45","142.250.195.10","QUIC","1292","Initial, DCID=d700ffd4fe16e943, PKN: 1, CRYPTO, PING, CRYPTO, CRYPTO, CRYPTO, PING, PADDING, PING, PING, PADDING, PING, CRYPTO, CRYPTO, CRYPTO, PADDING"
"236","6.255902","192.168.29.45","142.250.195.10","QUIC","1292","Initial, DCID=d700ffd4fe16e943, PKN: 2, CRYPTO"
"237","6.256374","192.168.29.45","142.250.195.10","QUIC","1292","Initial, DCID=d700ffd4fe16e943, PKN: 3, PADDING, PING, PADDING, PING, CRYPTO, PING, PADDING, PING, CRYPTO, PING, CRYPTO, CRYPTO, PADDING"
"238","6.257000","192.168.29.45","142.250.195.10","QUIC","121","0-RTT, DCID=d700ffd4fe16e943"
"239","6.259587","192.168.29.45","199.232.105.140","QUIC","1292","Protected Payload (KP0), DCID=d0fefe10e86abeca293b214000c1595fe1"
"240","6.259852","192.168.29.45","199.232.105.140","QUIC","933","Protected Payload (KP0), DCID=d0fefe10e86abeca293b214000c1595fe1"
"241","6.266839","199.232.105.140","192.168.29.45","QUIC","66","Protected Payload (KP0)"
"242","6.298063","142.250.195.10","192.168.29.45","QUIC","82","Initial, SCID=f700ffd4fe16e943, PKN: 1, ACK"
"243","6.298451","142.250.195.10","192.168.29.45","QUIC","82","Initial, SCID=f700ffd4fe16e943, PKN: 2, ACK"
"244","6.299900","142.250.195.10","192.168.29.45","QUIC","1292","Initial, SCID=f700ffd4fe16e943, PKN: 3, ACK, PADDING"
"245","6.301046","142.250.195.10","192.168.29.45","QUIC","1292","Initial, SCID=f700ffd4fe16e943, PKN: 4, ACK, PADDING"
"246","6.301046","142.250.195.10","192.168.29.45","QUIC","1292","Initial, SCID=f700ffd4fe16e943, PKN: 5, CRYPTO, PADDING"
"247","6.301490","142.250.195.10","192.168.29.45","QUIC","1292","Handshake, SCID=f700ffd4fe16e943"
"248","6.302070","142.250.195.10","192.168.29.45","QUIC","1292","Handshake, SCID=f700ffd4fe16e943"
"249","6.302070","142.250.195.10","192.168.29.45","QUIC","1292","Handshake, SCID=f700ffd4fe16e943"
"250","6.302482","142.250.195.10","192.168.29.45","QUIC","227","Protected Payload (KP0)"
"251","6.302766","192.168.29.45","142.250.195.10","QUIC","1292","Initial, DCID=f700ffd4fe16e943, PKN: 5, ACK, PADDING"
"252","6.303030","192.168.29.45","142.250.195.10","QUIC","81","Handshake, DCID=f700ffd4fe16e943"
"253","6.303892","192.168.29.45","142.250.195.10","QUIC","81","Handshake, DCID=f700ffd4fe16e943"
"254","6.307278","192.168.29.45","142.250.195.10","QUIC","125","Handshake, DCID=f700ffd4fe16e943"
"255","6.307610","192.168.29.45","142.250.195.10","QUIC","113","Protected Payload (KP0), DCID=f700ffd4fe16e943"
"256","6.308391","192.168.29.45","142.250.195.10","QUIC","556","Protected Payload (KP0), DCID=f700ffd4fe16e943"
"257","6.350188","142.250.195.10","192.168.29.45","QUIC","1026","Protected Payload (KP0)"
"258","6.357482","142.250.195.10","192.168.29.45","QUIC","163","Protected Payload (KP0)"
"259","6.358161","192.168.29.45","142.250.195.10","QUIC","73","Protected Payload (KP0), DCID=f700ffd4fe16e943"
"260","6.367985","142.250.195.10","192.168.29.45","QUIC","69","Protected Payload (KP0)"
"261","6.410291","192.168.29.45","142.250.195.10","QUIC","74","Protected Payload (KP0), DCID=f700ffd4fe16e943"
"262","6.438682","142.250.195.10","192.168.29.45","QUIC","64","Protected Payload (KP0)"
"263","6.439024","192.168.29.45","142.250.195.10","QUIC","75","Protected Payload (KP0), DCID=f700ffd4fe16e943"
"264","6.472037","192.168.29.45","199.232.105.140","QUIC","80","Protected Payload (KP0), DCID=d0fefe10e86abeca293b214000c1595fe1"
"265","6.491640","199.232.105.140","192.168.29.45","TLSv1.3","1510","Application Data"
"266","6.492009","199.232.105.140","192.168.29.45","TLSv1.3","916","Application Data"
"267","6.492078","192.168.29.45","199.232.105.140","TCP","54","51769  >  443 [ACK] Seq=17637 Ack=7912 Win=65280 Len=0"
"268","6.502052","142.250.195.10","192.168.29.45","QUIC","1288","Protected Payload (KP0)"
"269","6.502689","142.250.195.10","192.168.29.45","QUIC","1292","Protected Payload (KP0)"
"270","6.502998","192.168.29.45","142.250.195.10","QUIC","79","Protected Payload (KP0), DCID=f700ffd4fe16e943"
"271","6.503301","142.250.195.10","192.168.29.45","QUIC","589","Protected Payload (KP0)"
"272","6.503590","142.250.195.10","192.168.29.45","QUIC","77","Protected Payload (KP0)"
"273","6.504016","199.232.105.140","192.168.29.45","QUIC","66","Protected Payload (KP0)"
"274","6.504774","192.168.29.45","142.250.195.10","QUIC","75","Protected Payload (KP0), DCID=f700ffd4fe16e943"
"275","6.505097","192.168.29.45","142.250.195.10","QUIC","75","Protected Payload (KP0), DCID=f700ffd4fe16e943"
"276","6.535374","192.168.29.45","142.250.195.10","QUIC","76","Protected Payload (KP0), DCID=f700ffd4fe16e943"
"277","6.570903","142.250.195.10","192.168.29.45","QUIC","66","Protected Payload (KP0)"
"278","6.722479","192.168.29.45","199.232.105.140","QUIC","80","Protected Payload (KP0), DCID=d0fefe10e86abeca293b214000c1595fe1"
"279","6.756309","199.232.105.140","192.168.29.45","QUIC","66","Protected Payload (KP0)"
"280","6.971826","192.168.29.45","199.232.105.140","QUIC","80","Protected Payload (KP0), DCID=d0fefe10e86abeca293b214000c1595fe1"
"281","7.004119","199.232.105.140","192.168.29.45","QUIC","66","Protected Payload (KP0)"
"282","7.203632","192.168.29.45","239.255.255.250","SSDP","484","NOTIFY * HTTP/1.1 "
"283","7.216121","192.168.29.45","199.232.105.140","QUIC","80","Protected Payload (KP0), DCID=d0fefe10e86abeca293b214000c1595fe1"
"284","7.225072","199.232.105.140","192.168.29.45","TLSv1.3","462","Application Data"
"285","7.225244","199.232.105.140","192.168.29.45","TLSv1.3","129","Application Data"
"286","7.225297","192.168.29.45","199.232.105.140","TCP","54","51769  >  443 [ACK] Seq=17637 Ack=8395 Win=65024 Len=0"
"287","7.232217","192.168.29.45","239.255.255.250","SSDP","493","NOTIFY * HTTP/1.1 "
"288","7.239805","199.232.105.140","192.168.29.45","TLSv1.3","910","Application Data"
"289","7.246048","192.168.29.45","192.168.29.1","TCP","66","51775  >  53 [SYN] Seq=0 Win=65535 Len=0 MSS=1460 WS=256 SACK_PERM"
"290","7.246124","199.232.105.140","192.168.29.45","TLSv1.3","116","Application Data"
"291","7.246227","192.168.29.45","199.232.105.140","TCP","54","51769  >  443 [ACK] Seq=17637 Ack=9313 Win=64000 Len=0"
"292","7.246604","192.168.29.45","192.168.29.1","TCP","66","51776  >  53 [SYN] Seq=0 Win=65535 Len=0 MSS=1460 WS=256 SACK_PERM"
"293","7.247688","199.232.105.140","192.168.29.45","QUIC","66","Protected Payload (KP0)"
"294","7.250501","192.168.29.1","192.168.29.45","TCP","66","53  >  51775 [SYN, ACK] Seq=0 Ack=1 Win=29200 Len=0 MSS=1460 SACK_PERM WS=64"
"295","7.250669","192.168.29.45","192.168.29.1","TCP","54","51775  >  53 [ACK] Seq=1 Ack=1 Win=65280 Len=0"
"296","7.251279","192.168.29.45","192.168.29.1","TCP","56","51775  >  53 [PSH, ACK] Seq=1 Ack=1 Win=65280 Len=2 [TCP PDU reassembled in 298]"
"297","7.251629","192.168.29.1","192.168.29.45","TCP","66","53  >  51776 [SYN, ACK] Seq=0 Ack=1 Win=29200 Len=0 MSS=1460 SACK_PERM WS=64"
"298","7.251741","192.168.29.45","192.168.29.1","DNS","95","Standard query 0xd5ff A w3-reporting.reddit.com"
"299","7.252116","192.168.29.45","192.168.29.1","TCP","54","51776  >  53 [ACK] Seq=1 Ack=1 Win=65280 Len=0"
"300","7.253641","199.232.105.140","192.168.29.45","TLSv1.3","90","Application Data"
"301","7.254556","192.168.29.45","192.168.29.1","TCP","56","51776  >  53 [PSH, ACK] Seq=1 Ack=1 Win=65280 Len=2 [TCP PDU reassembled in 302]"
"302","7.254694","192.168.29.45","192.168.29.1","DNS","95","Standard query 0x9e14 HTTPS w3-reporting.reddit.com"
"303","7.263525","192.168.29.1","192.168.29.45","TCP","54","53  >  51775 [ACK] Seq=1 Ack=44 Win=29248 Len=0"
"304","7.266228","199.232.105.140","192.168.29.45","TLSv1.3","420","Application Data"
"305","7.266345","192.168.29.45","199.232.105.140","TCP","54","51769  >  443 [ACK] Seq=17637 Ack=9715 Win=65280 Len=0"
"306","7.271592","192.168.29.1","192.168.29.45","TCP","54","53  >  51775 [ACK] Seq=1 Ack=3 Win=29248 Len=0"
"307","7.273654","192.168.29.1","192.168.29.45","TCP","55","53  >  51775 [PSH, ACK] Seq=1 Ack=44 Win=29248 Len=1 [TCP PDU reassembled in 318]"
"308","7.282198","199.232.105.140","192.168.29.45","TLSv1.3","224","Application Data"
"309","7.283329","192.168.29.1","192.168.29.45","TCP","54","53  >  51776 [ACK] Seq=1 Ack=44 Win=29248 Len=0"
"310","7.293768","192.168.29.1","192.168.29.45","TCP","54","53  >  51776 [ACK] Seq=1 Ack=3 Win=29248 Len=0"
"311","7.304977","199.232.105.140","192.168.29.45","TLSv1.3","295","Application Data"
"312","7.305066","192.168.29.45","199.232.105.140","TCP","54","51769  >  443 [ACK] Seq=17637 Ack=10126 Win=65024 Len=0"
"313","7.308292","199.232.105.140","192.168.29.45","TLSv1.3","1510","Application Data"
"314","7.308550","199.232.105.140","192.168.29.45","TLSv1.3","855","Application Data"
"315","7.308610","192.168.29.45","199.232.105.140","TCP","54","51769  >  443 [ACK] Seq=17637 Ack=12383 Win=65280 Len=0"
"316","7.311300","192.168.29.1","192.168.29.45","TCP","55","53  >  51776 [PSH, ACK] Seq=1 Ack=44 Win=29248 Len=1 [TCP PDU reassembled in 323]"
"317","7.325006","192.168.29.45","192.168.29.1","TCP","54","51775  >  53 [ACK] Seq=44 Ack=2 Win=65280 Len=0"
"318","7.333839","192.168.29.1","192.168.29.45","DNS","147","Standard query response 0xd5ff A w3-reporting.reddit.com CNAME reddit.map.fastly.net A 151.101.157.140"
"319","7.334446","192.168.29.45","192.168.29.1","TCP","54","51775  >  53 [FIN, ACK] Seq=44 Ack=95 Win=65280 Len=0"
"320","7.338155","192.168.29.1","192.168.29.45","TCP","54","53  >  51775 [FIN, ACK] Seq=95 Ack=45 Win=29248 Len=0"
"321","7.338253","192.168.29.45","192.168.29.1","TCP","54","51775  >  53 [ACK] Seq=45 Ack=96 Win=65280 Len=0"
"322","7.356533","192.168.29.45","192.168.29.1","TCP","54","51776  >  53 [ACK] Seq=44 Ack=2 Win=65280 Len=0"
"323","7.358134","192.168.29.1","192.168.29.45","DNS","189","Standard query response 0x9e14 HTTPS w3-reporting.reddit.com CNAME reddit.map.fastly.net SOA ns1.fastly.net"
"324","7.360535","192.168.29.45","192.168.29.1","TCP","54","51776  >  53 [FIN, ACK] Seq=44 Ack=137 Win=65280 Len=0"
"325","7.361521","192.168.29.45","151.101.157.140","TCP","66","51777  >  443 [SYN] Seq=0 Win=65535 Len=0 MSS=1460 WS=256 SACK_PERM"
"326","7.361764","192.168.29.45","239.255.255.250","SSDP","540","NOTIFY * HTTP/1.1 "
"327","7.362499","192.168.29.1","192.168.29.45","TCP","54","53  >  51776 [FIN, ACK] Seq=137 Ack=45 Win=29248 Len=0"
"328","7.362593","192.168.29.45","192.168.29.1","TCP","54","51776  >  53 [ACK] Seq=45 Ack=138 Win=65280 Len=0"
"329","7.388664","151.101.157.140","192.168.29.45","TCP","66","443  >  51777 [SYN, ACK] Seq=0 Ack=1 Win=65535 Len=0 MSS=1460 SACK_PERM WS=512"
"330","7.388809","192.168.29.45","151.101.157.140","TCP","54","51777  >  443 [ACK] Seq=1 Ack=1 Win=65280 Len=0"
"331","7.389593","192.168.29.45","239.255.255.250","SSDP","548","NOTIFY * HTTP/1.1 "
"332","7.390129","192.168.29.45","151.101.157.140","TLSv1.3","2106","Client Hello (SNI=w3-reporting.reddit.com)"
"333","7.404753","192.168.29.45","239.255.255.250","SSDP","538","NOTIFY * HTTP/1.1 "
"334","7.421135","151.101.157.140","192.168.29.45","TCP","54","443  >  51777 [ACK] Seq=1 Ack=1461 Win=148992 Len=0"
"335","7.421236","151.101.157.140","192.168.29.45","TCP","54","443  >  51777 [ACK] Seq=1 Ack=2053 Win=152064 Len=0"
"336","7.429915","151.101.157.140","192.168.29.45","TLSv1.3","1510","Server Hello, Change Cipher Spec, Application Data, Application Data"
"337","7.436043","192.168.29.45","151.101.157.140","TLSv1.3","118","Change Cipher Spec, Application Data"
"338","7.438103","151.101.157.140","192.168.29.45","TLSv1.3","139","Application Data"
"339","7.438193","192.168.29.45","151.101.157.140","TCP","54","51777  >  443 [ACK] Seq=2117 Ack=1542 Win=65280 Len=0"
"340","7.439126","192.168.29.45","151.101.157.140","TLSv1.3","146","Application Data"
"341","7.439708","192.168.29.45","151.101.157.140","TLSv1.3","2829","Application Data"
"342","7.439855","192.168.29.45","151.101.157.140","TLSv1.3","638","Application Data"
"343","7.454756","151.101.157.140","192.168.29.45","TCP","54","443  >  51777 [ACK] Seq=1542 Ack=2117 Win=152064 Len=0"
